{
  "id": "0c1d2e3f-4a5b-4c6d-0e1f-2a3b4c5d6e7f",
  "type": "energy.trade.cancelled",
  "source": "commerce-api",
  "time": "2025-01-15T14:03:21Z",
  "data": {
    "trade_id": "4e6f8a2c-1b3d-4a5c-8e9f-0a1b2c3d4e5f",
    "kind": "h2-sale",
    "quantity_kg": 120.0,
    "price_minor": 54000,
    "cancelled_at": "2025-01-15T14:03:20Z"
  }
}
